author_name,author_url,language,original_language,profile_photo_url,rating,relative_time_description,text,time,translated,place_id
Garrett Abbott,https://www.google.com/maps/contrib/109931790762737810540/reviews,en,en,https://lh3.googleusercontent.com/a-/ACNPEu-JVD0us3o-bx1z0GlExo0z2K8Miy2h6gN-0gbChA=s128-c0x00000000-cc-rp-mo-ba5,5,a month ago,"My wife and I love stopping at Fox Farm Vineyards. They have an excellent assortment of wines and do some wonderful things with Pinot. David, the proprietor, is very personable and makes your tasting informative and fun. Great wine, unpretentious and tasty, definitely worth a stop",1662499559,False,ChIJMTSRWtFBlVQRsvwSfNM8hYQ
Paul Dunham,https://www.google.com/maps/contrib/100230113341673091161/reviews,en,en,https://lh3.googleusercontent.com/a-/ACNPEu_9B_rU-d61mAjMqV7ya9GBMJ9M2BXQPMzRbQU=s128-c0x00000000-cc-rp-mo-ba2,3,2 weeks ago,Nice place but when we arrived they said we weren’t allowed to get a flight cause we didn’t have a reservation. But we could buy glasses. So you won’t sell me 5 2-oz (10 oz total) pours (which makes me buy bottles) but you will sell me 2 5-oz glasses (10 oz total). Curious isn’t it? 🤔,1665178714,False,ChIJMRYV56ZMlVQRq_z7DoE-utQ
Jim Western,https://www.google.com/maps/contrib/114013059311008765532/reviews,en,en,https://lh3.googleusercontent.com/a/ALm5wu0Dk_yCy1nturs9z8d_fCeAyt3ORrdJVT3K9UHp=s128-c0x00000000-cc-rp-mo,4,2 months ago,Enjoyed their summer music series. Visited with family and friends and enjoyed some great wine. It's great to see a lot of young families with young children enjoying their evening out.,1659759229,False,ChIJCdCGvxtAolQROdtZvLqCSjY
Reed Yurchak,https://www.google.com/maps/contrib/111034074559254031299/reviews,en,en,https://lh3.googleusercontent.com/a-/ACNPEu8JnSZ4DgVeNGub-mCglH_-M0910MD7UI4ZHjXVbg=s128-c0x00000000-cc-rp-mo,5,4 months ago,"Enjoyed meeting the CEO, CFO, CTO, head accountant, chief oenophile, and oh yes, Doug too",1655582310,False,ChIJU3otJEkVolQResH9oAum1wo
Adam Neumeier,https://www.google.com/maps/contrib/116441704185363315141/reviews,en,en,https://lh3.googleusercontent.com/a/ALm5wu0fJF0tq55ltuO5XF9U0NDsMdEgYl9AMhqH1EI2=s128-c0x00000000-cc-rp-mo-ba3,5,6 months ago,"If you are looking for a place with friendly staff, an amazing view of Mt. Hood, and even better wine this is the place! The tasting room is beautiful, with large windows and lots of natural light for a cozy experience on days when it is raining.  On sunny days, the deck is wonderful. Sidereus is a must stop when wine tasting!",1650823269,False,ChIJrc2KGVgXlVQRQ0F1VM9-d4E
Raye Smith,https://www.google.com/maps/contrib/111688859752428309297/reviews,en,en,https://lh3.googleusercontent.com/a/ALm5wu3UMmIeYsBKKYFFAUWfqDWbwQKXiB0f9BKSYxkd=s128-c0x00000000-cc-rp-mo-ba4,5,a year ago,"Love this winery!
As a member of Harvest Host, we stayed  the night in our motorhome overlooking the South Umpqua River.

Freed Estate Vineyards grow the grapes that produce their wines. I tasted noteworthy vintages from 2014, 2016 and 2018 with my favorite from their 2018 crops. For my palate it was a fabulous year for many of their wines. However,  their newly released 2016 Tempranillo is exceptional.

It is a family run estate and my list of favorable adjectives to describe this family is lengthy.  I found our wine expert, Brian, to be extremely  knowledgeable, welcoming and a pleasure to talk with. I was lucky to meet a few of his family, as well.

If you get the opportunity, buy a bottle of wine and sit along the river.",1633462273,False,ChIJZS1JIJ05xFQRBC3XPLxiy0o
Scott Seymour,https://www.google.com/maps/contrib/105627702220514579825/reviews,en,en,https://lh3.googleusercontent.com/a/ALm5wu1J-w7sAmpG2Gl3sELTgLjJrV_vcLeJNYcwk8Jl=s128-c0x00000000-cc-rp-mo-ba4,5,2 years ago,"Cute little winery right off of I5. Beautiful old barn tasting room. Went on Friday night and had a blast! Great food, awesome live music from 6-9 and also played some Wine-O (bingo) between set breaks for the band. Had a great time out and will definitely be back!",1578847092,False,ChIJRT13WfUvwVQRJ4Sfbq24iQs
Masta Splinta,https://www.google.com/maps/contrib/103180461724008009172/reviews,en,en,https://lh3.googleusercontent.com/a-/ACNPEu-RYP4ZaGpQIw_V0cDIQUTTMU74ONTgYdOj6yt1oA=s128-c0x00000000-cc-rp-mo,1,6 months ago,"So I bought a bottle of their blueberry wine from the ester short park Vancouver farmers market, and it turned out to be completely mothered and turned into vinegar, so I contacted the company and they replaced the bottle of wine, so I got the monarch rose the following Saturday and opened it 3 days later and it was amazing......... 4 days later the wine was total vinegar...... It was kept refrigerated and horizontal the entire time... Contacted the company about this and got a very rude response!!!!! If you like short lived wine and can drink it all in one sitting this is your go to company, if you enjoy savoring your wine do not buy from this company.",1649562663,False,ChIJdSZbemcXllQR4xP5GBpkEKs
justin eastes,https://www.google.com/maps/contrib/109021743074122319914/reviews,en,en,https://lh3.googleusercontent.com/a-/ACNPEu_-VUM9yQgyMYEAdiV7RvxJhxRdlT3GnM_SjAwUSiA=s128-c0x00000000-cc-rp-mo-ba4,5,a year ago,My wife and I picked up a bottle of the Postlewaits 2018 Pinot Noir.  Was absolutely amazing. Will definitely be trying their other brands and would definitely recommend to others! Thanks for an amazing quality spirit!,1617920341,False,ChIJVxWn79JmlVQR_6LMG1LCGOE
Trisha Dieckmann,https://www.google.com/maps/contrib/107749162911050560769/reviews,en,en,https://lh3.googleusercontent.com/a-/ACNPEu_YfAFz-1GgXsdAGQjZ6AM-lvIdPnmI8py83FMQ4Q=s128-c0x00000000-cc-rp-mo,5,3 years ago,"I have worked with Tumwater Vineyard as an employee of Viva! Events (a Portland-based, woman-owned business that creates events to engage, motivate and grow businesses). Tumwater tasting room (Barrel Room) is a beautiful event venue for a corporate reception or dinner, and the wine is excellent. The location is close to downtown Portland compared to similar wineries.  The team there, especially Pascale,  was great to work with, and I would highly recommend them for events.",1545260347,False,ChIJCYfyC79xlVQRabdCd9q13Is
Rich Callahan,https://www.google.com/maps/contrib/104539987368230349246/reviews,en,en,https://lh3.googleusercontent.com/a/ALm5wu3xMKlvbIvuu-lU-pJ2WmvCbpMSnKZQ3Xv8FFgJ=s128-c0x00000000-cc-rp-mo,5,8 months ago,The LDV / ESANDE wines are spectacular!  Scott and Diane take great personal care of the vineyard and overseeing the wine making.  It really shows up in these fantastic wines.  Highly recommend!,1643843965,False,ChIJbUpk2zEZlVQRIubeW2siYTg
Elise Sarasin,https://www.google.com/maps/contrib/103686860689864780413/reviews,en,en,https://lh3.googleusercontent.com/a-/ACNPEu9wIx0WvTH9sBoCKTqf5w03VMcEmlm5XUZn3UKE=s128-c0x00000000-cc-rp-mo,5,3 years ago,"Lovely winery with stunning views! Great variety of wines (we loved the Estate Pinot, it’s not your typical Pinot). There was even a bowl of fresh cherries to enjoy! It wasn’t crowded and the deck had incredible views. Highly recommend!",1562003126,False,ChIJc1og-nwQllQREipN_ZWqFZI
Sarah Burns,https://www.google.com/maps/contrib/102383103060147804320/reviews,en,en,https://lh3.googleusercontent.com/a/ALm5wu2j1UBtbwYEbd6btcjucUA5Mn2NLxAmD8i3Jwck=s128-c0x00000000-cc-rp-mo,5,7 months ago,"Great wines, lovely layout and vibes, a wonderful place to spend an afternoon. The head wine guy, Chris, was very knowledgeable and professional.",1646520156,False,ChIJmeb78RIRllQRqJ7O_XVMOYc
Heather Hemingway-Hales,https://www.google.com/maps/contrib/103832346789667666885/reviews,en,en,https://lh3.googleusercontent.com/a/ALm5wu2JaxsoBolTHu81X0rDLkkJyHppzGtnVD_A8FTS=s128-c0x00000000-cc-rp-mo,5,2 months ago,So lovely! Everyone should visit and try the wine!,1659395775,False,ChIJeXrjc3Q_lVQRpVINbOBBcyU
Bill Ormsby,https://www.google.com/maps/contrib/116583053037685109218/reviews,en,en,https://lh3.googleusercontent.com/a-/ACNPEu-l0N5wUxpoTyhILcvfjPQKB6asfvbICoe7BR46=s128-c0x00000000-cc-rp-mo,5,a year ago,Wonderful experience tasting. Great wines and view. Good place for Pinot Noir and Chardonnay.,1619762861,False,ChIJbTJ1IK8elVQRELHLlNMv_ro
Harrison Parker,https://www.google.com/maps/contrib/102844480738908247331/reviews,en,en,https://lh3.googleusercontent.com/a-/ACNPEu_n-PSDJ0n3AOjtw7hJk-_xK-vTKHU9kXgAm_2wtg=s128-c0x00000000-cc-rp-mo,5,a month ago,This spot is a hidden gem! They have both Columbia valley  wines as well as international imports. They have lots of amazing flights to choose from. Family and pet friendly!,1663537612,False,ChIJlwRSLWkOllQRIsBo8nzjT2o
Caroline Barnes,https://www.google.com/maps/contrib/110758821143425479600/reviews,en,en,https://lh3.googleusercontent.com/a/ALm5wu2fYY2zqEPcRO2DVQi7P0JAbC6QSe_nkcQ7hLOf=s128-c0x00000000-cc-rp-mo,5,a year ago,"I came across Stomp, Croft Vineyard’s tasting room, when I first moved to Oregon. And I must say, their wine is some of the best I’ve ever had. Now it’s all I drink!

The savoir vivre is my favorite red of them all. A silky, well-balanced Pinot noir with warm cherry notes and just the right amount of dryness. I paired it with a braised duck the other night and it was absolutely delightful.

For white, their Pinot Gris is my go-to. Acidic, fruit forward, bright, refreshing- perfect wine for a hot, sunny day. I love how well-rounded it is because it’s something both my Chardonnay and Sav blanc drinking friends can enjoy. Personally, I think it goes best with a nice seafood or spicy Thai dish.

Not to mention the grapes are organically grown and their wine is certified as salmon safe. So if you’re an environmentally conscious wine lover,  you’re in the right place! John and Amber are lovely people and their passion for wine shines through. Go support this family-owned business, folks. You won’t regret it!",1605294459,False,ChIJ-7nIyYkDwFQRjebO6KnKurk
Kay Doolittle,https://www.google.com/maps/contrib/113121350272076455097/reviews,en,en,https://lh3.googleusercontent.com/a/ALm5wu36B2P18Q2ErNZ1P1HGXRGx2dOX5dEoq2jqYGq2=s128-c0x00000000-cc-rp-mo,5,a year ago,"Don't know why more folks don't go out to enjoy fall colors in the Vineyards.

Nice, quiet wine tasting today - thanks, Jolene!",1635021298,False,ChIJySZob3MbxFQRUp-3qtZHOt0
Shane Farnor,https://www.google.com/maps/contrib/101787482294427942412/reviews,en,en,https://lh3.googleusercontent.com/a-/ACNPEu8uzVFem1uxoMt00mVw6fibpPvPyzZczsX97CjaLnM=s128-c0x00000000-cc-rp-mo,5,2 months ago,"My partner and I had such a wonderful outside tasting at Cooper Mountain Vineyards! Our host was Matthew and he was very attentive, professional, and so knowledgeable about the wines. He clearly has a passion for what he does. Also, during our tasting we had the pleasure to meet the fabulous Barbara (Operations Director for Cooper Mountain) and head winemaker, Gilles! Both were so charming, funny, and so very welcoming. And then, there was the WINE! Yum! We enjoyed all the wines, but were especially fond of the Old Vines Pinot Noir and the Pinot Gris! Their Gamay was also quite tasty with vibrant color, great fruity flavor, and smooth texture that made it easy to sip. Highly recommend you make an effort to taste at this pioneering biodynamic winery. I have so much respect for what they do. We'll most definitely be back!",1659679715,False,ChIJMxAl8A8SlVQRfRr6ogGZUos
Michelle Tsai,https://www.google.com/maps/contrib/110494344010627685743/reviews,en,en,https://lh3.googleusercontent.com/a/ALm5wu2tQbKwbIFOk_t7ibuvdSWIJeySwZREI9dUEphQur4=s128-c0x00000000-cc-rp-mo,5,3 months ago,The hoagie from the food truck was out of this world. The rosé pinot noir went down smoothly. Highly recommended! Great space with awesome mountain views too!,1657662305,False,ChIJG1BslP0FllQRMRc0KTybvYM
Danielle Knott,https://www.google.com/maps/contrib/113218020729446508567/reviews,en,en,https://lh3.googleusercontent.com/a-/ACNPEu9SqxAXzPwjJkLBxBinz-AOM2rkifsYUf2efqzk2w=s128-c0x00000000-cc-rp-mo,5,2 months ago,"Spent the whole afternoon with Max and Hannah enjoying Johan and Cow Horn’s beautiful wines. The hospitality, quality, and thoughtfulness has been unmatched in the Willamette Valley. For fans of unique flavors and varietals, and appreciators of land stewardship. Not to miss.",1659738288,False,ChIJKd2kUOKp6lQRY1WIzI2s7eo
Kam Man,https://www.google.com/maps/contrib/101279278877279137873/reviews,en,en,https://lh3.googleusercontent.com/a/ALm5wu0MtA31lUVp_nYOqCyL-f5R6E10VVCqbFo1Hlef=s128-c0x00000000-cc-rp-mo,5,2 years ago,Excellent wine. Friendly service. A relaxing experience.,1593228898,False,ChIJ4ZSprkEVolQRF385x5xV5SE
Dave,https://www.google.com/maps/contrib/115349659657047658946/reviews,en,en,https://lh3.googleusercontent.com/a-/ACNPEu9FXR6_KiQ3vg9IHGDGiy1eToqGOpgKucYdR7Or4ow=s128-c0x00000000-cc-rp-mo-ba4,5,10 years ago,"Truely, one of North America's original wineries (for Pinot Gris at the least). It shows in the authenticness of the tasting room, the staff (during our tasting, the winemaker came out from the back rooms and spent a while pouring & discussing this year's harvest), and not the least, the wines. Very convenient location, affordable wine, and when it's not busy you can get some great interesting information.",1320692341,False,ChIJOY09IMJIlVQRpTPMLDeAF-Y
Annie Hanson,https://www.google.com/maps/contrib/113839205041704651621/reviews,en,en,https://lh3.googleusercontent.com/a/ALm5wu2rJTwtygR909CCh-3ei06vlrKZ34g87EPgtFlx=s128-c0x00000000-cc-rp-mo,2,4 years ago,"We had visited several wineries while staying in Oregon last week. This one came recommended but we were terribly disappointed. We arrived a little bit after 11am. We were the only ones there. The man behind the counter we found to be inattentive, and gave me the feeling that he felt very ""put out"" having to deal with us (there was only 2 of us). This was a vast contrast from the welcoming and friendly atmosphere we had experienced at other places so far. The tasting room is crowded with wine barrels and equipment, the view up at the winery is beautiful so we opted to sit outside. Every time we went in for our next tasting he just poured it and then didn't tell us anything about it....what winery doesn't tell you about what you are drinking? This man just couldn't be bothered. I only liked the Syrah but ended up not buying anything (this was the only place I didn't purchase anything). The tasting itself was pricey $20.00 - more than I paid anywhere else. I personally would not go back here, with so many to choose from there is no reason. Hope others have a better experience.",1530539249,False,ChIJqWJnw1kVlVQRsxOCFStREcs
Jen Bloom,https://www.google.com/maps/contrib/111787701660699318770/reviews,en,en,https://lh3.googleusercontent.com/a-/ACNPEu_HxrMsEraAcTRvrPmDhSpdWRCsaZWmMwC4BazdFN8=s128-c0x00000000-cc-rp-mo-ba5,5,6 years ago,"My mother and I absolutely loved our stop here on our wine tour. We purchased two bottles of their ice wine and another white wine that was to die for, and I'm typically a red fan. The scenery was beautiful and the staff was incredibly helpful. Really enjoyed sitting outside enjoying the weather while we tasted a variety of wines.",1465849006,False,ChIJddLIQcE_lVQRx0_Di8fTizg
Max B,https://www.google.com/maps/contrib/103393121382180674788/reviews,,,https://lh3.googleusercontent.com/a-/ACNPEu91Ea5_r_ioYZk-XF_-zU03p6KxY-HO08e52Hp6FEI=s128-c0x00000000-cc-rp-mo-ba4,5,4 months ago,,1655917506,False,ChIJD8AtMrJrlVQRUuqG5P1zHFI
Magdalyn Elizabeth,https://www.google.com/maps/contrib/100838946638645963954/reviews,en,en,https://lh3.googleusercontent.com/a-/ACNPEu8u1Q-hnX8CnMJfOsLqW-bjD-r1ccGCRKEdBdpleEA=s128-c0x00000000-cc-rp-mo-ba4,4,a year ago,The court yard was lovely. We loved watching the bees buzz around the large lavender bushes. We had a white wine lover and this was the only place that served a Chardonnay and Riesling. They also offered a cheese board for purchase and we noticed other wineries didn’t offer food. Rating this 4 stars because the views from the website do not represent the views you’ll have while seated. Our server was low energy.,1626636959,False,ChIJUygBx6U4lVQRcoRiiyxSX0E
Tim Hoffman,https://www.google.com/maps/contrib/105078521711390214693/reviews,en,en,https://lh3.googleusercontent.com/a/ALm5wu0Wvmr9_6in2h2ycIwNVXMbYlLnluvQXMspRKXV=s128-c0x00000000-cc-rp-mo,5,4 months ago,Beautiful patio area under the trees. Super nice and knowledgeable staff and excellent wines.  Must stop in.  Halfway between Eugene and Corvallis.,1655787545,False,ChIJVwz6Uv9UwFQR4DxPw4BLxRY
Matt Wellumson,https://www.google.com/maps/contrib/111025253317439441493/reviews,en,en,https://lh3.googleusercontent.com/a-/ACNPEu8iiX3nBr2IJXjHKFe8V-1_MSL_9kF6BBHyQXuWYw=s128-c0x00000000-cc-rp-mo-ba5,5,3 months ago,"Great atmosphere, came on a quiet Monday and mostly had the place to myself. Their take on wine is quite unique and very good. I really enjoy the Pinot Gris as well as the cuvée probably worth getting a bottle of both!",1658779769,False,ChIJ0Wg7T5yq6lQRJKYZZfiLfNY
A H,https://www.google.com/maps/contrib/104940108418251622052/reviews,en,en,https://lh3.googleusercontent.com/a/ALm5wu0y31tcr-PX61c6btavNQO8Y0Mcpt3Z3R8UkUVW=s128-c0x00000000-cc-rp-mo-ba4,5,a year ago,"Delicious wood fire margarita pizza
Face rock creamery cheese & crackers
Fair prices & friendly faces- thank you!",1634505050,False,ChIJP6YY-PUZxFQRcNX4gfED1dY
Daniel Spitzer,https://www.google.com/maps/contrib/111392069415317047549/reviews,en,en,https://lh3.googleusercontent.com/a/ALm5wu3jWs-9otCrJwS9Mza-RuOqEqGmPgJYxszaQYuI=s128-c0x00000000-cc-rp-mo,5,a month ago,Great wine. Great staff. Lots of fun.,1662308053,False,ChIJyS-YaWlqolQRBi8ZSO8OqCc
Tania Tran,https://www.google.com/maps/contrib/116830540217289806469/reviews,en,en,https://lh3.googleusercontent.com/a-/ACNPEu-RO1LBqIJj4UZeE1Jus_QFKfiEH0XkYqq2gQJZTLE=s128-c0x00000000-cc-rp-mo-ba3,5,3 years ago,"Delicious Spanish wines and beautiful grounds! We especially enjoyed the ambiance - sitting on the patio on a sunny day while listening to Spanish music. Relaxing view of vineyards, water fountains, and birds.",1559175458,False,ChIJ-9G5FrpDolQRdju0bfr0ckk
Jeffrey Johnston,https://www.google.com/maps/contrib/103787972491188187570/reviews,en,en,https://lh3.googleusercontent.com/a-/ACNPEu_wlIPiAlr8epHX-rx5-jWGxnZj1LwgN9q_KokI=s128-c0x00000000-cc-rp-mo,5,a month ago,"While the wine is nice and venue idyllic, what prompts me to take the time (rare) to craft a review and give Beacon Hill a 5-Star rating is the hospitality.  I wanted to show some friends Tony Soter's first Oregon vineyard so we popped in for a tasting.  It just so happened that our impromptu visit late in the afternoon coincided with a pre-emptive power shutoff due to wildfire activity.  Have you ever seen a street-corner performer simultaneously playing drums, harmonica and accordion?  In this instance the one-man band was Tyson, the GM for Beacon Hill. He could have easily shut down the property but was steadfast in giving his guests a great experience in spite of the challenges of not having refrigeration and other amenities.  I greatly value ingenuity and creativity in the face of adversity especially where hospitality is involved, cheers to Tyson for having customer care as his number one objective. It turned out to be a fun shared experience, we all gave him a nice and well-deserved toast and  I look forward to the next visit when the switch is turned back on!",1663717375,False,ChIJP4oE-mI4lVQRCRDI6MT_Uvc
Asher Faber,https://www.google.com/maps/contrib/110005650473752209966/reviews,,,https://lh3.googleusercontent.com/a-/ACNPEu_aTKi7Rh_rCkirCUrInpgpsPG8At6J7YFaYZjufA=s128-c0x00000000-cc-rp-mo-ba4,3,5 years ago,,1503267926,False,ChIJj2Qvl94ZxFQRzzpRcggMpY8
Paige Stinebaugh,https://www.google.com/maps/contrib/103452969652294589646/reviews,en,en,https://lh3.googleusercontent.com/a-/ACNPEu8lesUnywHy0KjTjHEcKNvZchTkDQx8DgZicDqkgA=s128-c0x00000000-cc-rp-mo-ba4,5,4 years ago,This is definitely one of Walla walla’s most well known and premier wineries. After a short drive through he vines you find yourself in a great tasting room right in the vines! Lots of parking and a great open deck for sipping your wine away. We sampled about 5 reds and enjoyed all of the immensely. If you’re on the south side be sure to stop here!,1518803424,False,ChIJH5S1EzVColQR8lHZ-Cfcytc
Madison King,https://www.google.com/maps/contrib/105206200411867701134/reviews,,,https://lh3.googleusercontent.com/a/ALm5wu0end-x_EvkzObC47vA_YEtp_G8pVuFxr6MyiJV=s128-c0x00000000-cc-rp-mo,5,a year ago,,1629385551,False,ChIJkeT9BsghwVQRooOxSS2xBoc
robert tiedeman jr,https://www.google.com/maps/contrib/112482422716491482102/reviews,en,en,https://lh3.googleusercontent.com/a/ALm5wu2WU6968KOUfET1GVBHVG09nYEYg5fvCkiICwfC=s128-c0x00000000-cc-rp-mo,5,6 months ago,We enjoyed a wonderful tasting here and bought a CPL bottles. The young lady that walked us through our tasting was so sweet and informative. She really knew the wines. The landscape and views were as nice as the wines. We loved the rustic and natural atmosphere as opposed to some of the more sleek and modern wineries we have visited. The music was relaxing and a perfect volume. Just an overall lovely experience.,1649821247,False,ChIJlavJJWRrlVQRZ1HT7t4_eho
V M,https://www.google.com/maps/contrib/115454941372543762511/reviews,en,en,https://lh3.googleusercontent.com/a-/ACNPEu-jfj2XKdhDUEAORiu_fGsjcR0mR0oTkqTOiQ9AgQ=s128-c0x00000000-cc-rp-mo-ba5,5,10 months ago,"I love this winery! The place is beautiful! It looks like a vineyard that you would find somewhere in Italy.  They're very friendly and knowledgeable about their wines.
They just opened up their new tasting room and it is so so beautiful!! I couldn't take pictures of the inside... I guess I'm going to have to go back to do it 😏",1638856233,False,ChIJIVweGlYTlVQR_NyQpg103p4
Matias Sanchez,https://www.google.com/maps/contrib/103494632482863141237/reviews,en,en,https://lh3.googleusercontent.com/a-/ACNPEu9_KxmtH9_S6K8VUdVGpMPO23wjZtNTXqFFYajJfMk=s128-c0x00000000-cc-rp-mo,5,4 years ago,The wine here blows my mind away!,1533678636,False,ChIJPyUzT_0WlVQRPplhbRhoBv8
Chas Jones,https://www.google.com/maps/contrib/100431423731265254062/reviews,en,en,https://lh3.googleusercontent.com/a-/ACNPEu8kz9kicPOvnhewPUcKTCyp86K3YJGfImyMRI8FDQ=s128-c0x00000000-cc-rp-mo-ba4,3,5 years ago,"Average wine tasting experience in downtown Philomath. Wine club is a good deal with free tastings, wine discount, and no purchase obligation.",1484824883,False,ChIJ1_Wx2YM4wFQR_XpeBVyu5OY
Rebecca s,https://www.google.com/maps/contrib/111658523157475978214/reviews,en,en,https://lh3.googleusercontent.com/a-/ACNPEu8UqEz1htzDbCYKZH7SM1BqPRFyarqThyLTJulK=s128-c0x00000000-cc-rp-mo-ba5,5,2 years ago,So good! Amazing location and phenomenal wine! Highly recommend coming here.,1601841254,False,ChIJQXrpeGJqolQRcWwGiWeDXoA
Jack Holley,https://www.google.com/maps/contrib/113057126354306710369/reviews,en,en,https://lh3.googleusercontent.com/a/ALm5wu10x06ABKa81FEaAWuN55qmT-hLyW4mC3Lx0oUk=s128-c0x00000000-cc-rp-mo,4,a week ago,Good wine.   Good food.   Good atmosphere.   Good setting.,1666041571,False,ChIJ36P7AXQFwVQRKGN8GaJT4x0
Madison Roszak,https://www.google.com/maps/contrib/116023154988632429908/reviews,en,en,https://lh3.googleusercontent.com/a-/ACNPEu80P6hQrpenqfUJkEl2QZzF3nI4CcDIhIPlCEL_pQ=s128-c0x00000000-cc-rp-mo,5,a year ago,"I had such a wonderful time at left coast estate! Thank you, Sue, for taking such great care of us! We ordered flights which was very fun. I'm usually a red wine drinker but the whites were not too sweet so I enjoyed them more than usual. The highlight, though, was the queen bee bubbly! There's some sort of process with their own bees that feeds the yeast that are little balls on the bottom. I think, I don't really remember the science, but it was freakin' amazing! One of the best sparkling wines of my life. We also got a couple charcuterie boards which was packed with tasty snacks and cheeses (the onion one was !!! so good, followed by the merlot as my fav). They were very accommodating to keep the nuts in a separate bowl because I'm allergic. Though they were out of the Italian meats, the turkey panini with aoli was incredibly flavorful and filling. The service was amazing. Sue was very knowledgeable, attentive but not intrusive, and seemed infested in us having an amazing experience. The scenery is beautiful as well, I didn't know this part of Oregon had a big wine scene (I lived down here for a year six years ago but I was just back visiting). The estate is nestled in rolling hills and farmland with a small body of water as you enter and tall trees around the tasting area. I wish I lived closer, I'd be back a billion times, especially for that bubbly!",1627653981,False,ChIJkaHszW2r6lQRNe-crjrns5o
Jesus Verdugo,https://www.google.com/maps/contrib/108691888130571134725/reviews,,,https://lh3.googleusercontent.com/a/ALm5wu1l1AibPWz48LdcM9YRzvWYt9Ri2-xJ1tThMgj3=s128-c0x00000000-cc-rp-mo,5,8 months ago,,1646083248,False,ChIJD8G5c2lqolQRRBxNCEFs0NQ
c daug,https://www.google.com/maps/contrib/118178197956401443305/reviews,en,en,https://lh3.googleusercontent.com/a/ALm5wu10PYfwFtLellPki2B4trVmrr7fTLLu03egq7zh=s128-c0x00000000-cc-rp-mo,5,a year ago,Thank you Gary and Lynn. We appreciate great customer service. Thanks,1627582816,False,ChIJgdjxjCEjxFQR9qCx7V8hYfY
Ryan Jones,https://www.google.com/maps/contrib/115765614978206526863/reviews,,,https://lh3.googleusercontent.com/a-/ACNPEu9t_DP4m8Np2P1xlw2g4j5vBxy9zo_rfkugvm-cPQ=s128-c0x00000000-cc-rp-mo-ba3,5,4 years ago,,1524351502,False,ChIJpVBrF1KnlVQRfhZoupOviT4
