author_name,author_url,language,original_language,profile_photo_url,rating,relative_time_description,text,time,translated,place_id
Cassi Johnson,https://www.google.com/maps/contrib/115700455019643100358/reviews,en,en,https://lh3.googleusercontent.com/a-/ACNPEu8kjceeEdP98FxxLPfn_iPRvRNAsXtkhs62dE4Xbw=s128-c0x00000000-cc-rp-mo,5,a year ago,"Great spot for our Bachelorette party.  Great service, food, and of course wine!",1627795364,False,ChIJVfYnVGdZpFQR8X47_NgHmWo
Daphne Schultz,https://www.google.com/maps/contrib/113435021590245525186/reviews,en,en,https://lh3.googleusercontent.com/a-/ACNPEu8mlzutPUb4DExQZEXDeA_8ZZBB4RRGllomKskF_Dc=s128-c0x00000000-cc-rp-mo-ba3,5,4 years ago,Tasting room for local wine made in Baker County by Travis Cook and his family runs the winery and his sister Cody serves up cheese. I love the Merlot and the sparkling white wine on tap! Great service and atmosphere!,1527989148,False,ChIJC8FEpTHppFQRxUVfOt0xZvk
Eric Villman,https://www.google.com/maps/contrib/112110670109465904757/reviews,en,en,https://lh3.googleusercontent.com/a-/ACNPEu9e1M5cpwDWiO2OOLc6JrEzVex0-NIyU6PtSCQnSw=s128-c0x00000000-cc-rp-mo-ba3,5,2 months ago,"Nice tasting room a bit off the path. If you know where Champoeg park is, it's right near that.
Beautiful tasting area, a rustically decorated modern barn. The wine was enjoyable with a comprehensive selection for their tasting menu. They have a very impressive selection of charcuterie items.",1660774655,False,ChIJo2XmyitolVQRbXHbCFguAdU
Karen Doss,https://www.google.com/maps/contrib/112988311835187181894/reviews,,,https://lh3.googleusercontent.com/a-/ACNPEu-7SpiC7ALrlBqWnz-_yqsJWH6scA-RPt02i_QdnFE=s128-c0x00000000-cc-rp-mo-ba3,5,a year ago,,1615836362,False,ChIJm3c7lPRAlVQRuaHtEOs-UN4
Edith Cushing,https://www.google.com/maps/contrib/117920851604754328572/reviews,en,en,https://lh3.googleusercontent.com/a/ALm5wu33Grw5NaMjX1ZeKYERUtZgTyjPhk3fN0rrgHOL=s128-c0x00000000-cc-rp-mo,1,3 months ago,"Served from a tiny window, felt as if we were bothering them and felt very rushed. Fastest 4 tastings I have ever had.",1658538083,False,ChIJJyem-IMTwFQRIDvFuH85wfM
Mateo Bedoya,https://www.google.com/maps/contrib/107132722436696559037/reviews,en,en,https://lh3.googleusercontent.com/a/ALm5wu2u9MF18X1DE9Dql78VJDn0_FGbtjuB5w-UUzhi=s128-c0x00000000-cc-rp-mo,5,3 years ago,"Great experience! Simple, unpretentious place with great wines and nice people. I liked the fact that I had to call the staff once I arrived and he came straight from working on the vineyard. We had a nice talk about winemaking. It made me feel closer to the grapes than most of the wineries visits I had during my trip.
This was what I was looking for when I planned my wine tasting trip!",1558800037,False,ChIJjY_fnzJBxFQRsXCsLBepZ2Y
KAREN BLAIR,https://www.google.com/maps/contrib/115503516103436998407/reviews,en,en,https://lh3.googleusercontent.com/a-/ACNPEu9SUy87NqQsRPzpufZSha46IBTd0SNyyfJytkuTkQ=s128-c0x00000000-cc-rp-mo-ba4,5,4 months ago,A friend's Wedding right there in the middle of the vineyard!!! Beautiful setting!!,1654399591,False,ChIJ22vW2sjFolQRohtq-192_d0
Adam Clay,https://www.google.com/maps/contrib/118232536470405300469/reviews,en,en,https://lh3.googleusercontent.com/a-/ACNPEu-w227RXCV1ZvlHrN6VswnHuDWu2ym5M5AUVvmRuSo=s128-c0x00000000-cc-rp-mo-ba4,4,11 years ago,They have a couple of really nice wines.,1307039813,False,ChIJJY-MdOhNlVQRCqCbnKtdtKM
Paul Christofanelli,https://www.google.com/maps/contrib/117168484510029462966/reviews,en,en,https://lh3.googleusercontent.com/a-/ACNPEu-Y_oDOWoO1iKx8kqYVHyUJ4sFIkr1IYVRf52HkLw=s128-c0x00000000-cc-rp-mo,5,2 months ago,"Great place, nice wine selections, nice pours, chocolate with the port, everything one could want!",1661637134,False,ChIJWVWjowhXwVQRRF_91U0QSSE
Carolyn Hellwege,https://www.google.com/maps/contrib/103546783406411527643/reviews,en,en,https://lh3.googleusercontent.com/a/ALm5wu1e2TqLJaDvihNQkbemsuVXKikCjU7OFwqnDkSu=s128-c0x00000000-cc-rp-mo,4,3 months ago,Was very enjoyable  we are people  who enjoy J Scott wine.,1658542768,False,ChIJmTGBLT4fwVQRAQKcK3r8iko
Wynterly Clovis,https://www.google.com/maps/contrib/103996260140507029804/reviews,en,en,https://lh3.googleusercontent.com/a-/ACNPEu_NUGcUX6vdab91ecZNNh3LvCQpmCHxFbW7xzzNbCU=s128-c0x00000000-cc-rp-mo-ba5,5,2 years ago,We sat outside near the vines. It was so romantic. The server was extremely nice. The wine was delish. We ended up buying a bottle. Highly recommend.,1594564055,False,ChIJCX2rOPLwv1QRFCK2BKVIZ6s
AJ Hermandorfer,https://www.google.com/maps/contrib/103800938983749544320/reviews,en,en,https://lh3.googleusercontent.com/a-/ACNPEu_lMsVHlxGP-2u2kpQvrvnjdRwP2AzRWA_v8fEF=s128-c0x00000000-cc-rp-mo,5,4 years ago,This was by far our favorite tasting room in the Mcminnville area. Ben was a phenomenal host and made the entire experience so great. He let us taste a wide variety of wines while doing an excellent job answering all of our questions. Great wine with a very welcoming tasting room.,1533068850,False,ChIJ8aRHHMNIlVQRQnGaf0_Goq8
Dayna Del Mar,https://www.google.com/maps/contrib/100070858094963289342/reviews,en,en,https://lh3.googleusercontent.com/a-/ACNPEu_MYAefm0TvQcLcnMz1cfpGYqu_T5vOEyH8VM30Mg=s128-c0x00000000-cc-rp-mo-ba4,5,6 years ago,"Super friendly, top notch staff with great wine knowledge! Love, love, love their oaked, delicious 2013 Guadalupe Pinot Gris. Seriously, I didn't know such a thing existed and it changed my life! Really cute wine tasting room with generous cheese platters and locally displayed art.",1471922486,False,ChIJibeHC8I_lVQRRUEMX0sGxnk
Signe Mortensen,https://www.google.com/maps/contrib/100839928986550784610/reviews,en,en,https://lh3.googleusercontent.com/a-/ACNPEu-PVHZ1yVlmdwz4kmQnpVcbVWXl7IFkI4UJGolF=s128-c0x00000000-cc-rp-mo,5,a year ago,"We just had our Dad's 80th Birthday on the Vineyard and it was an incredible experience!  Lynette and Bob were the most gracious hosts and treated us like family.  They were super accommodating with all my decorations and considerations for the comfort of our group - especially with Covid still on the mind! We were able to feel safe and secure while enjoying our family experience! They provided the canopies, tables and chairs. The Homestead Picnic area was beautifully picturesque with Hood in the distance as the backdrop for the Vineyard (on a clear day at least)!

And did I mention the wine?  Lynette treated us to tastings of all their very best wines and had a special bottle waiting for my Dad when he arrived.  I especially enjoyed the Chardonnay and brought a bottle home to remember our time!  Quite a few of my family members bought additional bottles on our way out as we thanked Lynette for her hospitality!

The only thing to be aware of is that the drive up is very steep on a gravel road (to be expected at a Vineyard!) so bring your vehicle that can grip the road on the way up.  But the reward at the top of the hill is MORE than worth it.

Just do it.  Enjoy the wine and enjoy the view.

Thank you Lynette and team!
The ""Mortensens""",1629124982,False,ChIJk8AyJCMJllQR5nx396gJhgc
Kent Beaber,https://www.google.com/maps/contrib/104594524402409406976/reviews,en,en,https://lh3.googleusercontent.com/a-/ACNPEu9M5ZAceUP7K0si53ujhlcSRHrF2DGVV0FG-T9kMA=s128-c0x00000000-cc-rp-mo-ba3,4,a year ago,Authentic and unique. They are innovative in approach- both leading the revival of  the ancient clay amphorae method of creating wine as well as cultivating and producing delicious lesser known varietals.,1630385116,False,ChIJFdNgwmNplVQRXBrRCOLMckk
Jill Bianchi,https://www.google.com/maps/contrib/108719921217002737989/reviews,en,en,https://lh3.googleusercontent.com/a-/ACNPEu8tOv08CUGVR6mLTpVH0B46z06gNCUNx7qHysNPDA=s128-c0x00000000-cc-rp-mo,5,a year ago,This is one of my favorite wineries here in a OR. The white wines are just so delicious and smooth and totally affordable. The reds are also incredible and a bit fancier and worth every penny. They are also pet friendly. Huge lawn is a fabulous place to relax. Family owned and Beatrice and her mom are always so nice!,1634529987,False,ChIJMSbWUPpNlVQR1MkBJSsgj0Y
Bronson Creek,https://www.google.com/maps/contrib/103691537358029403646/reviews,,,https://lh3.googleusercontent.com/a/ALm5wu0huQARktQuh15mlCGfwUHu1slttNHbrNjRE054=s128-c0x00000000-cc-rp-mo,5,4 years ago,,1516421502,False,ChIJp3JTBYtAlVQRWNjBaSgUZGo
Bryan Blair,https://www.google.com/maps/contrib/100555348666891815207/reviews,en,en,https://lh3.googleusercontent.com/a/ALm5wu1E29SfjEZRZ4ov_HLnLYVeErwkTo7wGQHjXE3L=s128-c0x00000000-cc-rp-mo,5,2 years ago,Very lovely indeed,1595487960,False,ChIJ-cbq2qUxwVQRrpkiGzmha1s
Graham M,https://www.google.com/maps/contrib/117236778880737385525/reviews,en,en,https://lh3.googleusercontent.com/a-/ACNPEu9R6cqusqTP-FwR7namHLOUl3puPzAeaKOtGHUXOA=s128-c0x00000000-cc-rp-mo-ba4,5,a month ago,"Simply breathtaking. Incredible wine for all types of people with breath taking views!

The culinary program here is remarkable. You can go for a standard tasting and order from a small pantry menu. This menu is much more then just charcuteries (which they have too), great option for lunch.

They also offer a Provisions tasting which is multi courses all sourced from their biodynamic farm. The quality of ingredients is wonderful and rotates seasonally.

There sparkling brute rose is one of my favorites. Post tasting you can see stunning 360 views of the valley. Soter is some special for sure.",1661789674,False,ChIJTU2OG5w4lVQRrDuNGLmBUbM
Sonya C,https://www.google.com/maps/contrib/114073428148522876465/reviews,en,en,https://lh3.googleusercontent.com/a/ALm5wu3s_dl8OFRzkMvB-2fZuj-FAMTOEIKAYxxjFp9t=s128-c0x00000000-cc-rp-mo,5,3 months ago,What a great family owned winery.  So great!!! A gem in the valley,1656737025,False,ChIJ0WqRrXv7v1QRRW4uXuXu8s8
A B Cannon,https://www.google.com/maps/contrib/110986433584225921384/reviews,en,en,https://lh3.googleusercontent.com/a-/ACNPEu_Hv7-uxq-IyOu1gmr5oZZQ_4CWOOPrvKVTMMewtQ=s128-c0x00000000-cc-rp-mo-ba2,2,3 years ago,"Atmosphere and service can greatly affect an experience, and I would say the stuffy (read pretentious) atmosphere, coupled with lackluster service left much to be desired. Wine was okay, but our primary server was terse and provided little information about the wines, even with prompting. While Mark Ryan came highly recommended by other proprietors, I wouldn't recommend this tasting room if you're looking for a laid back and welcoming environment. If you're wanting something purely transactional, go for it.",1568524217,False,ChIJly6JF2NqolQRggxngApCIEU
Iam Human,https://www.google.com/maps/contrib/102210360965532919321/reviews,en,en,https://lh3.googleusercontent.com/a-/ACNPEu_2yFCvZbG9YD-g8vtjQSa2QFZDZuFil3dNngG2Sw=s128-c0x00000000-cc-rp-mo-ba4,5,11 months ago,"We slide into the spot 40 minutes before closing, no problems!  Bryan was fantastic even at the end of the day, plenty of energy, knowledgeable and fun.  Tastings was great and loved the sparkling and Pinot noir flight. Must go!",1636850678,False,ChIJAzo9JZRUlVQR8WVYDGuY5Eg
Amanda Brooks,https://www.google.com/maps/contrib/116375061013684039600/reviews,en,en,https://lh3.googleusercontent.com/a-/ACNPEu9c_5UwbqvJrrsZ1ELgixdrnmzA-rui2ZeJypY0qA=s128-c0x00000000-cc-rp-mo-ba4,5,11 months ago,"Wonderful organic wines, beautiful atmosphere, and a highly knowledgeable staff and owner. We spoke off and on for a few hours about the high level processes they go through to insure the have a high quality product. You must try their sparkling wines and the red blend.",1637362324,False,ChIJk8ryMWxqolQRi_2UorK7JbI
Richard Nordell,https://www.google.com/maps/contrib/117988810258847382210/reviews,en,en,https://lh3.googleusercontent.com/a-/ACNPEu-ZY_rMdFqukcHUhUNlfzwZcnJ4tawatKgfWnN1UxQ=s128-c0x00000000-cc-rp-mo,5,3 years ago,"I haven't been to the farm, but I went to a Antiquum Farms wine tasting dinner at BTG in SLC and the wines were amazing, Stephen Hagen the owner was great to talk to, and I am looking forward to making a trip to Oregon...soon!",1567057453,False,ChIJuQcnBo-qwVQRmu-NMvQBQqQ
Cindy Richards,https://www.google.com/maps/contrib/112570889841311499709/reviews,en,en,https://lh3.googleusercontent.com/a/ALm5wu1anQ8oIGHEIyNu7MxYInHRVDUQmuwGBdBZTOh_=s128-c0x00000000-cc-rp-mo,5,a year ago,"Wine and wood-fired pizza, need I say more?",1620566427,False,ChIJdyoJ3-Y_lVQRHxeL_rGS5xM
Katrina Purdy,https://www.google.com/maps/contrib/100675576940281754066/reviews,en,en,https://lh3.googleusercontent.com/a-/ACNPEu8TNK5GzZZdrbxQAwi_4g1hJahbrVQvMRfLoBTE6L4=s128-c0x00000000-cc-rp-mo-ba4,5,a year ago,"Whether you're looking for the perfect bottle for any occasion this is the place to go. Great atmosphere, and friendly service and fantastic wine!",1615845270,False,ChIJG70EpRQZwVQRNGFsIkVzWm4
Melissa Morris,https://www.google.com/maps/contrib/112263666382425984386/reviews,en,en,https://lh3.googleusercontent.com/a/ALm5wu1mz1v23AtSw89nx8YXCIxQfJCIKbukpcPJgkWl=s128-c0x00000000-cc-rp-mo-ba3,5,11 months ago,Wine is amazing! We showed up as a group of six and they were having a private event but still let us do a tasting. Super friendly staff. Will definitely be back!,1636265165,False,ChIJg0Kbhxu5olQR6RnVzz1xp58
mark marble,https://www.google.com/maps/contrib/104118542440570825604/reviews,en,en,https://lh3.googleusercontent.com/a-/ACNPEu-ZbC5HoilOFVlsVD8BBBX1dfvBZQIkSVZ36uMXzc0=s128-c0x00000000-cc-rp-mo-ba4,5,a year ago,Some of the best reds you will find in Oregon.,1616801239,False,ChIJGwkzz5lPlVQRrC17L0dfWfE
Nina North Murphy,https://www.google.com/maps/contrib/101901511073817144342/reviews,en,en,https://lh3.googleusercontent.com/a-/ACNPEu82ZVQ6IP_BdCKeuzhPKC9mvzCmPu24PNW_9VeyME4=s128-c0x00000000-cc-rp-mo-ba6,5,2 months ago,Wonderful wine tasting experience! Charles’ knowledge and presentation was amazing.,1659972614,False,ChIJJ4Cw8WI4lVQRvACw7eJsUjQ
Gerry Rhoades,https://www.google.com/maps/contrib/108718649947457803927/reviews,en,en,https://lh3.googleusercontent.com/a-/ACNPEu8wqP6KAUbSabuo_lsndssycDm04kGV5a29aRVTVA=s128-c0x00000000-cc-rp-mo-ba2,3,3 years ago,"Can't say anything about the wines, but seriously, three ads per screen page from the Motley Fool?  You can't get any tackier than that.  Ads on a website are a sure sign that you might get malware  on your computer.
Doubt I'll visit this place.",1555976060,False,ChIJc3SZKa8OllQRJecy6f4_aXQ
Victor Polanco,https://www.google.com/maps/contrib/116480930731861435723/reviews,en,en,https://lh3.googleusercontent.com/a-/ACNPEu-eEX9TI1wuN-YaNPHcwuvEpOhjo2k9thMMn2nacg=s128-c0x00000000-cc-rp-mo,5,3 years ago,"My wife and I joined some friends for an afternoon of fun and wine tasting yesterday and had a “where have you been all my life” experience.  Every wine ranged from great to exceptional - probably, some of the best that are available locally!  Chill vibe, wonderful hosts, and venue ... and just 10-15 minutes from our home.  We became Wine Club Members on the spot!",1565557294,False,ChIJObZutQtplVQRc95atPynNYE
Emily Kalenius,https://www.google.com/maps/contrib/104946978700125842820/reviews,en,en,https://lh3.googleusercontent.com/a-/ACNPEu99xJcGT3Z7k0-KqGuuw4mMGhcqqqbruh2pcy870w=s128-c0x00000000-cc-rp-mo,1,a year ago,"We have purchased wine from this winery many times and enjoy their products. Today we arrived at 5:39. The website and the server confirmed they close at 6 pm but They refused to serve us despite arriving more than 20 minute prior to closure. This was a very sad. The rude disposition of the employee was also unfortunate.
We love to support local businesses but if they stop serving 20 minutes prior to closure it would
Be nice if they advertised this as we drove 30 minutes to patronize their establishment:(",1627261001,False,ChIJzd0nYwkCwFQRHiV267ogaRY
Som Chivukula,https://www.google.com/maps/contrib/112142191323881464581/reviews,en,en,https://lh3.googleusercontent.com/a-/ACNPEu8SCxinq827AXEMBe2tRK6MDF2xXyuiT1F2tQ6q-w=s128-c0x00000000-cc-rp-mo-ba4,5,a year ago,Great wines... excellent host. 🍷🍷🍷🍷🍷,1625428419,False,ChIJaeVPBSRdolQRos3L6ozhMAc
Paula Caudill,https://www.google.com/maps/contrib/114217106633296351451/reviews,,,https://lh3.googleusercontent.com/a-/ACNPEu_TgC1qV-EfiiOriTVs_b2jVIdq06pw5JsStpYiX7c=s128-c0x00000000-cc-rp-mo-ba3,4,11 years ago,,1293928145,False,ChIJ2w47hNEYxFQRz7fl4LE9Brs
Tim Theriac,https://www.google.com/maps/contrib/103065574666401052696/reviews,en,en,https://lh3.googleusercontent.com/a/ALm5wu0XkoMHwNDg5Gupi5lwgACZsfeG2FJ3DGCr_J4Z=s128-c0x00000000-cc-rp-mo,5,6 months ago,Los Rocosos Vineyards is one of the special gems in the walla walla valley.  Really enjoyed Roger and Lucinda they were very  friendly and accommodating it was a joy to spend time with. Really delicious wines especially the Sangiovese and Grenache. Look forward to another visit !,1649810229,False,ChIJoa66NRlFolQRl-EO1VCC_ns
Gloria Geleynse,https://www.google.com/maps/contrib/107952895474180697939/reviews,en,en,https://lh3.googleusercontent.com/a/ALm5wu1tY53ZeNLw-3DdWnO9erv9K21-pnwzhFwKQhoS=s128-c0x00000000-cc-rp-mo,5,a week ago,"Super fun, excellent wine, great employees!",1666310468,False,ChIJzTbmzalDolQRn6fWXh8Z4cw
Lauren S,https://www.google.com/maps/contrib/101028285500475223492/reviews,en,en,https://lh3.googleusercontent.com/a-/ACNPEu92GS0qqmlpGjW_NGK76oK3wjrH1E1qX39prtkEfkU=s128-c0x00000000-cc-rp-mo,5,a year ago,"Beautiful grounds on top of a hill make for a private, personal setting. Very welcoming and loved the wine. Such a unique location, definitely call ahead.",1633780022,False,ChIJuXKqgmdAlVQRiNqTtgHGRXI
Jaren Morris,https://www.google.com/maps/contrib/101661652184882919811/reviews,en,en,https://lh3.googleusercontent.com/a-/ACNPEu_gcGCR8IBBESXJmEyWx_wq8rxmZTRvqhXw65b-j0M=s128-c0x00000000-cc-rp-mo-ba4,5,2 months ago,Such a nice place and the owner is so sweet! The wine is great too!,1659822299,False,ChIJv8IM-BtBlVQRjM70I7_7W9E
Guillaume Thibault,https://www.google.com/maps/contrib/109429137995753290509/reviews,en,en,https://lh3.googleusercontent.com/a-/ACNPEu8w0npVGacwfazDf3JuGGlG947YIpSIOzs-sWcs=s128-c0x00000000-cc-rp-mo-ba3,1,2 months ago,"We were doing a discovery weekend tour to find good new pinot noir for our cave and subscribe memberships, so we decided to make a reservation for a tasting.
The reservation was really easy as they had openings all day long, but it's not what we were told when we arrived:
- we first sat outside, but we were told to move because they were ""expecting a group""
- we could not seat elsewhere outside because there was no shade and it was noon.
- we asked to move two seats about three feet to be in the shade and our request was rejected.
- charcuterie board was not available as you have to pre-order them 24 hours beforehand.
The person was just highly unpleasant and made us feel we were not welcome.
We simply left without tasting.
We went to two wineries close by and has a wonderful rest of our day.
Worst tasting experience every.",1659865422,False,ChIJs8lYqgVLlVQR11eksO7l_-k
Jana Rocheleau,https://www.google.com/maps/contrib/111900852248174163776/reviews,en,en,https://lh3.googleusercontent.com/a-/ACNPEu9Mv_YMMl9-REbEUqiXKAXNX0hcLnW8r7wwSxCMVA=s128-c0x00000000-cc-rp-mo-ba5,5,a year ago,The wines were phenomenal. I don't think I have ever had a tasting so different. I ended buying six bottles and signing up for the wine club. Everyone I met there was very knowledgeable and passionate about the wine. Loved the view and the area.,1631241926,False,ChIJ_ezN9eYNllQR32-v_cmI_UM
Garrett,https://www.google.com/maps/contrib/106514880092822224464/reviews,,,https://lh3.googleusercontent.com/a/ALm5wu3oJ2DsUxXWxcapQYExPH0Iz29-lhjDc8EFW8_pLQ=s128-c0x00000000-cc-rp-mo,5,3 years ago,,1566746952,False,ChIJg1qHph__lVQRso6rCqW2DzQ
Jin Maggie,https://www.google.com/maps/contrib/102758428408734680004/reviews,en,en,https://lh3.googleusercontent.com/a-/ACNPEu9pzIK_uf6Scj8QZf0PXtkSWCLCUl5Eid5q3lAzfw=s128-c0x00000000-cc-rp-mo,5,11 months ago,I am glad I made the decision to make a stop off from I-5 to visit this winery. Tasted fine wines and learned so much wine making knowledge from the bartender! And the sunset is strikingly peaceful!,1637550879,False,ChIJ_2TqDSQXxFQRjbWMXQdeF_c
Brenda Bautista,https://www.google.com/maps/contrib/116066057003667829063/reviews,en,en,https://lh3.googleusercontent.com/a/ALm5wu2KcM36NbgMNgqDld2lH9cStuejWgBo3YpIYUJR=s128-c0x00000000-cc-rp-mo,5,4 years ago,"This was the last of the three wineries that we visited on our drive along Hwy 38. The other two being Lexeme and River’s Edge.  The wine was great and Bonnie Bradley makes you feel right at home.  We had our lunch on the hill overlooking the valley and what can I say.  Life is great, epically with good wine, good company and nice weather.",1530397010,False,ChIJPX_6LlZWwVQR6nWbJUrvLyE
Smiledoc,https://www.google.com/maps/contrib/106306768322167549917/reviews,en,en,https://lh3.googleusercontent.com/a-/ACNPEu_Gr1SYJc-lMaNxgjIBqfu1hx4bXn4DwWZBh-5RFw=s128-c0x00000000-cc-rp-mo-ba3,5,4 years ago,"great wine, great people, great location and facility",1522099905,False,ChIJb21eb2cVolQRY6JGmq_XmwA
Nakul Sawhney,https://www.google.com/maps/contrib/114823266902809699243/reviews,en,en,https://lh3.googleusercontent.com/a-/ACNPEu9V-VFOH92XuRARNErV3hsMwdRuUGCfZveYSUu21g=s128-c0x00000000-cc-rp-mo,5,2 years ago,Super!,1590458943,False,ChIJsaMyzeNJlVQRXL9vvq15duY
Dave Allen,https://www.google.com/maps/contrib/103343938682354568674/reviews,en,en,https://lh3.googleusercontent.com/a/ALm5wu0qdrpBi2CwqPZexlrDz6f2N45FcmnVDbzNv_Vj=s128-c0x00000000-cc-rp-mo,5,4 months ago,Wonderful  little  winery. Great  pinots and the staff is excellent.  Worth a visit!,1656033192,False,ChIJp6xxvqIOllQRNiNg9-9Uef4
Iris Nowning,https://www.google.com/maps/contrib/115284139440829343021/reviews,en,en,https://lh3.googleusercontent.com/a-/ACNPEu9VHqwqagGVbJauPadER3pFJu7iidUu50iFcjpPkQ=s128-c0x00000000-cc-rp-mo,5,a year ago,"This has been my favorite winery in west Salem for years. They always offer a wonderful assortment of wines for every pallet. The owner, Larry, is always kind and welcoming. Each time I bring friends or family to try their wines, they go home with many bottles! I highly recommend trying out this hidden gem. You won’t be disappointed!",1616324259,False,ChIJo2vqswFUlVQRgLZQzvRrp70
Camie Haverstick,https://www.google.com/maps/contrib/117477321205424435689/reviews,en,en,https://lh3.googleusercontent.com/a/ALm5wu3EiGTmO9A_opfIpggcCCFhKtMdrgNSsdF30dBx=s128-c0x00000000-cc-rp-mo,5,2 weeks ago,"Amazing wine and amazing views.  The Viognier is to die for.  Super friendly small family operation and you’re greeted by the cutest little winery dog, Monte.  A must visit in Walla Walla!",1665275481,False,ChIJ075thAlDolQRaq2G9jW141c
Mark Melsness,https://www.google.com/maps/contrib/103440537849935233606/reviews,en,en,https://lh3.googleusercontent.com/a-/ACNPEu8F4uqQdxhHoIlbrWptpLs5IDgsc_J_wjkZGEO5hw4=s128-c0x00000000-cc-rp-mo-ba5,5,a month ago,"We were a party of eight and our tour guide, Bradley, was awesome and very knowledgeable. We saw the oak barrels with wine in storage, the processing room and the bottling machine. We tasted a few good wines and even bought a few bottles to take home. Supper great time and a absolutely beautiful place. We will definitely be back!",1662852697,False,ChIJEZsIboQIwFQRNy3yOiTKe_Y
rachael crooke,https://www.google.com/maps/contrib/102901398310617662840/reviews,,,https://lh3.googleusercontent.com/a-/ACNPEu_w8j5V3pcMsRXylIcIyHNgawcMcy6U9cWvW10V=s128-c0x00000000-cc-rp-mo,5,2 years ago,,1601826671,False,ChIJ_UakGWQMllQRNgiEOSHJE6I
Snaily,https://www.google.com/maps/contrib/101557994888523144018/reviews,en,en,https://lh3.googleusercontent.com/a/ALm5wu0bo_Z5i5Av5EOSY28NeC2u4jyQBGq5mGvH4qxi=s128-c0x00000000-cc-rp-mo-ba4,5,a year ago,"What an amazing experience with great wine, beautiful and serene atmosphere, and lovely people. Private, family feel. We look forward to coming back again.",1622424455,False,ChIJ7TjgpUMUlVQRzpjqJAd3ifQ
Rob Owen,https://www.google.com/maps/contrib/100169796905443522534/reviews,,,https://lh3.googleusercontent.com/a/ALm5wu1A3OvAwgnTvyerqk633mOrT7TUitiaCA--SDPJ=s128-c0x00000000-cc-rp-mo,5,4 years ago,,1537923413,False,ChIJcS828idTwFQRsPkU2KLl1kQ
Lisa Gash,https://www.google.com/maps/contrib/100057485647915895166/reviews,en,en,https://lh3.googleusercontent.com/a/ALm5wu0TVFGm-IUGAhk47iQEYwvm0X01UVQPmtMSuKqM=s128-c0x00000000-cc-rp-mo,5,2 years ago,We visited a number of recommended wineries up and down the Oregon coast and found brigadoon to be our favorite hands down. The quality of wine was outstanding. Down to earth owners. Thoroughly enjoyed our visit. Highly recommend ordering their wine. Outstanding pinots.,1588478131,False,ChIJN8t-U-qqwVQRzqB7-njzzxw
